{"$schema":"https://json-schema.org/draft/2020-12/schema","$id":"https://nepa.local/schemas/calibration-baseline-owner-approval.schema.json","title":"M1-4a2 design-7.2.0 owner approval","type":"object","additionalProperties":false,"required":["schema_version","approved","reviewer","lineage_id","selection_ref","bundle_ref","assessment_ref","protocol_neutrality","baseline_2_of_3"],"properties":{"schema_version":{"const":"5.0"},"approved":{"const":true},"reviewer":{"type":"string","minLength":1},"note":{"type":"string"},"approved_at":{"type":"string","minLength":1},"lineage_id":{"type":"string","pattern":"^[0-9a-f]{64}$"},"selection_ref":{"$ref":"#/$defs/ref"},"bundle_ref":{"$ref":"#/$defs/ref"},"assessment_ref":{"$ref":"#/$defs/ref"},"protocol_neutrality":{"type":"object","additionalProperties":false,"required":["status","evidence_ref"],"properties":{"status":{"const":"pass"},"evidence_ref":{"$ref":"#/$defs/ref"}}},"baseline_2_of_3":{"type":"object","additionalProperties":false,"required":["trial_count","p2_passes","screening_pass","recomputed_from"],"properties":{"trial_count":{"const":3},"p2_passes":{"type":"integer","minimum":2,"maximum":3},"screening_pass":{"const":true},"recomputed_from":{"const":"assessment_ref"}}}},"$defs":{"ref":{"type":"object","additionalProperties":false,"required":["path","sha256"],"properties":{"path":{"type":"string","minLength":1},"sha256":{"type":"string","pattern":"^[0-9a-f]{64}$"}}}}}
