{"approved":true,"approved_at":"2026-09-05T10:58:28.754126+00:00","assessment_ref":{"path":"prompt-development/versions/v0/assessment-n003.json","sha256":"9c7bfe8f48592956e99c843306b2b09f5722e8e9dbc96d88c25e7ccadbd2e92e"},"baseline_2_of_3":{"p2_passes":3,"recomputed_from":"assessment_ref","screening_pass":true,"trial_count":3},"bundle_ref":{"path":"prompt-development/versions/v0/snapshot.json","sha256":"350382ded3f574f9d8180e7e5561b7079e3843f49fa8c95ef2304a25b1d83991"},"lineage_id":"4420296f4dead63a3119c49106e234147f4a69a1f4f4aecda8fa562af7944ab7","note":"项目负责人在已获知本 lineage V0 三样本全部通过后明确授权：“现在完成该change的后续任务，授权签字交接”。本记录由执行助手依据该授权落盘，批准所引用的 initial/repair bundle、协议中立证据与可重算 3/3 基准结果；不宣称生产质量已得到证明。","protocol_neutrality":{"evidence_ref":{"path":"prompt-development/versions/v0/neutrality.json","sha256":"17cb6d836ffb1d1fdc6db29a28d839cc1bb5d0e2035d8c34c166075b10eb9263"},"status":"pass"},"reviewer":"project-owner (current conversation)","schema_version":"5.0","selection_ref":{"path":"prompt-development/selection.json","sha256":"56f36fcea9e58bd1aa9944742bf5a26a464c92fb07ec91b36611d9ed90fca26e"}}